<?xml version = "1.0" encoding="UTF-8" standalone="no" ?>
<scene xmlns:xsi="http://www.w3.org/2001/XMLSchema-instance"
    xsi:noNamespaceSchemaLocation="scene.xsd">

    <params>
        <specular>10</specular>
        <colors>
            <color type="r">0</color>
            <color type="g">0</color>
            <color type="b">0</color>
        </colors>
    </params>

    <source>
        <coords type="center">
            <coord type="x">-1000</coord>
            <coord type="y">0</coord>
            <coord type="z">100</coord>
        </coords>
        <colors>
            <color type="r">255</color>
            <color type="g">255</color>
            <color type="b">255</color>
        </colors>
    </source>

    <sphere>
        <coords type="center">
            <coord type="x">100</coord>
            <coord type="y">-20</coord>
            <coord type="z">30</coord>
        </coords>
        <coord type="radius">20</coord>
        <surface>
            <coefs type="reflexion">
                <coef type="r">0</coef>
                <coef type="g">0</coef>
                <coef type="b">0</coef>
            </coefs>
            <coefs type="transmission">
                <coef type="r">0</coef>
                <coef type="g">0</coef>
                <coef type="b">0</coef>
            </coefs>
            <coefs type="diffusion">
                <coef type="r">0</coef>
                <coef type="g">0.8</coef>
                <coef type="b">0</coef>
            </coefs>
            <coefs type="specular">
                <coef type="r">0.7</coef>
                <coef type="g">0.7</coef>
                <coef type="b">0.7</coef>
            </coefs>
        </surface>
    </sphere>

    <sphere>
        <coords type="center">
            <coord type="x">100</coord>
            <coord type="y">-20</coord>
            <coord type="z">-30</coord>
        </coords>
        <coord type="radius">20</coord>
        <surface>
            <coefs type="reflexion">
                <coef type="r">0</coef>
                <coef type="g">0</coef>
                <coef type="b">0</coef>
            </coefs>
            <coefs type="transmission">
                <coef type="r">0</coef>
                <coef type="g">0</coef>
                <coef type="b">0</coef>
            </coefs>
            <coefs type="diffusion">
                <coef type="r">0</coef>
                <coef type="g">0.8</coef>
                <coef type="b">0</coef>
            </coefs>
            <coefs type="specular">
                <coef type="r">0.7</coef>
                <coef type="g">0.7</coef>
                <coef type="b">0.7</coef>
            </coefs>
        </surface>
    </sphere>

    <sphere>
        <coords type="center">
            <coord type="x">100</coord>
            <coord type="y">50</coord>
            <coord type="z">0</coord>
        </coords>
        <coord type="radius">10</coord>
        <surface>
            <coefs type="reflexion">
                <coef type="r">0</coef>
                <coef type="g">0</coef>
                <coef type="b">0</coef>
            </coefs>
            <coefs type="transmission">
                <coef type="r">0</coef>
                <coef type="g">0</coef>
                <coef type="b">0</coef>
            </coefs>
            <coefs type="diffusion">
                <coef type="r">0.8</coef>
                <coef type="g">0</coef>
                <coef type="b">0</coef>
            </coefs>
            <coefs type="specular">
                <coef type="r">0.7</coef>
                <coef type="g">0.7</coef>
                <coef type="b">0.7</coef>
            </coefs>
        </surface>
    </sphere>

    <sphere>
        <coords type="center">
            <coord type="x">200</coord>
            <coord type="y">00</coord>
            <coord type="z">0</coord>
        </coords>
        <coord type="radius">120</coord>
        <surface>
            <coefs type="reflexion">
                <coef type="r">0</coef>
                <coef type="g">0</coef>
                <coef type="b">0</coef>
            </coefs>
            <coefs type="transmission">
                <coef type="r">0</coef>
                <coef type="g">0</coef>
                <coef type="b">0</coef>
            </coefs>
            <coefs type="diffusion">
                <coef type="r">0</coef>
                <coef type="g">0</coef>
                <coef type="b">0.8</coef>
            </coefs>
            <coefs type="specular">
                <coef type="r">0.7</coef>
                <coef type="g">0.7</coef>
                <coef type="b">0.7</coef>
            </coefs>
        </surface>
    </sphere>

    <plan>
        <coords type="center">
            <coord type="x">150</coord>
            <coord type="y">0</coord>
            <coord type="z">0</coord>
        </coords>
        <coords type="normal">
            <coord type="x">-1</coord>
            <coord type="y">0</coord>
            <coord type="z">0</coord>
        </coords>
        <surface>
            <coefs type="reflexion">
                <coef type="r">0</coef>
                <coef type="g">0</coef>
                <coef type="b">0</coef>
            </coefs>
            <coefs type="transmission">
                <coef type="r">0</coef>
                <coef type="g">0</coef>
                <coef type="b">0</coef>
            </coefs>
            <coefs type="diffusion">
                <coef type="r">1</coef>
                <coef type="g">1</coef>
                <coef type="b">1</coef>
            </coefs>
            <coefs type="specular">
                <coef type="r">0</coef>
                <coef type="g">0</coef>
                <coef type="b">0</coef>
            </coefs>
        </surface>
    </plan>
</scene>